[
  {
    "source_id": "si-ac-001",
    "title": "Writing testable acceptance criteria",
    "doc_type": "acceptance_criteria",
    "content": "Acceptance criteria should be specific, observable, and testable. Prefer Given/When/Then or clear bullet outcomes that a reviewer can verify without guessing intent. Avoid vague words like \"fast\" or \"user-friendly\" unless you define measurable thresholds. Each criterion should map to at least one verification idea, and edge cases should be called out explicitly when they change expected behavior.",
    "status": "approved",
    "version": "1.0",
    "tags": ["acceptance-criteria", "story-quality", "qa"],
    "severity": null,
    "component": "story-analysis",
    "source_name": "Kernector Story Intelligence guidance",
    "updated_at": "2026-08-24"
  },
  {
    "source_id": "si-split-001",
    "title": "Splitting oversized stories",
    "doc_type": "story_analysis",
    "content": "A story is oversized when it mixes multiple user goals, spans unrelated components, or cannot be demonstrated in one short feedback loop. Split by independent value slices: separate happy path from edge handling, isolate setup work, or cut by persona or workflow step. After a split, each story should still deliver a coherent outcome with its own acceptance criteria and a clear done definition.",
    "status": "approved",
    "version": "1.0",
    "tags": ["story-splitting", "scope", "planning"],
    "severity": null,
    "component": "story-analysis",
    "source_name": "Kernector Story Intelligence guidance",
    "updated_at": "2026-08-24"
  },
  {
    "source_id": "si-explore-001",
    "title": "Exploratory testing charters for story analysis",
    "doc_type": "test_strategy",
    "content": "Use a short charter before exploring a story: target (feature or risk), resources (build, data, tools), and a time box. Focus the session on one mission such as \"find gaps between written acceptance criteria and actual behavior\" or \"probe permission boundaries around this workflow.\" Capture notes as questions, bugs, and follow-up ideas so findings feed story refinement, not only defect tickets.",
    "status": "approved",
    "version": "1.0",
    "tags": ["exploratory-testing", "charter", "qa"],
    "severity": null,
    "component": "qa",
    "source_name": "Kernector Story Intelligence guidance",
    "updated_at": "2026-08-24"
  },
  {
    "source_id": "si-sev-001",
    "title": "Severity versus priority in QA triage",
    "doc_type": "defect_triage",
    "content": "Severity describes impact on users or the system if the defect is true: data loss and security issues are higher severity than cosmetic copy issues. Priority describes when to fix relative to release goals and workarounds. A medium-severity defect can be high priority before a launch; a high-severity defect with a safe workaround may wait. Record both fields separately so triage debates stay precise.",
    "status": "approved",
    "version": "1.0",
    "tags": ["severity", "priority", "triage"],
    "severity": "high",
    "component": "defect-triage",
    "source_name": "Kernector Story Intelligence guidance",
    "updated_at": "2026-08-24"
  },
  {
    "source_id": "si-comp-001",
    "title": "Mapping story components to test focus",
    "doc_type": "qa_guidance",
    "content": "Identify which components a story touches—UI, API, auth, data storage, notifications—and let that drive test focus. Auth changes need session and permission checks; API changes need contract and error-path coverage; UI changes need accessibility and state transitions. When a story spans components, list the highest-risk boundary first and verify integration assumptions before deep happy-path polish.",
    "status": "approved",
    "version": "1.0",
    "tags": ["components", "test-focus", "risk"],
    "severity": null,
    "component": "qa",
    "source_name": "Kernector Story Intelligence guidance",
    "updated_at": "2026-08-24"
  },
  {
    "source_id": "si-defect-001",
    "title": "Defect report quality checklist",
    "doc_type": "defect_triage",
    "content": "A useful defect report states the expected result, the actual result, and the steps to reproduce with environment details. Include identifiers such as story or build when known, and attach evidence (screenshot, log excerpt, request id) when it shortens diagnosis. Avoid mixing multiple unrelated failures in one report; split them so severity and ownership stay clear.",
    "status": "approved",
    "version": "1.0",
    "tags": ["defects", "reporting", "qa"],
    "severity": "medium",
    "component": "defect-triage",
    "source_name": "Kernector Story Intelligence guidance",
    "updated_at": "2026-08-24"
  },
  {
    "source_id": "si-ambiguity-001",
    "title": "Ambiguity and missing-requirement signals",
    "doc_type": "story_analysis",
    "content": "Flag stories that use undefined actors, unspecified error handling, or success criteria that cannot be observed. Watch for missing states such as empty lists, partial failures, retries, and permission denials. When two readers would implement different behavior from the same text, treat that as a requirement gap and ask for an explicit decision before coding or deep test design.",
    "status": "approved",
    "version": "1.0",
    "tags": ["ambiguity", "requirements", "story-quality"],
    "severity": null,
    "component": "story-analysis",
    "source_name": "Kernector Story Intelligence guidance",
    "updated_at": "2026-08-24"
  },
  {
    "source_id": "si-nfr-001",
    "title": "Non-functional considerations on stories",
    "doc_type": "qa_guidance",
    "content": "Even feature stories often imply non-functional expectations: latency, accessibility, security, auditability, or resilience. Ask whether limits, timeouts, or compliance constraints belong in acceptance criteria. If NFRs are deferred, record that choice so QA does not silently assume production-grade behavior that the story never promised.",
    "status": "approved",
    "version": "1.0",
    "tags": ["nfr", "quality-attributes", "acceptance-criteria"],
    "severity": "info",
    "component": "qa",
    "source_name": "Kernector Story Intelligence guidance",
    "updated_at": "2026-08-24"
  }
]
